Tweets,Positive,Negative
بڑے ہی نمک حرام ہو تم لوگ مودی سے ہی کشمیر کا سودا کرتے ہو پھر دنیا دکھاوے کے لئے اسی پر بھوکتے ہو بڑے ہی منافق مکار ہو,yes,
گاڑی کے اوپر پاکستان کا جھنڈا اور گاڑی کے اندر انڈیا کے گانے سننے والو وطن کی ہواہیں تمہیں نمک حرام کہتی ھیں,yes,
قوم کے لیے پرانے خاندانی نمک حرام ہیں ,yes,
چند کتے سرخے ,yes,
دلال نمک حرام ,yes,
وطن فروش,yes,
 جا نہ مادرچود ,yes,
 مادرچود رنڈی ,yes,
 سب سے بڑے مادرچود ہیں یہ دونوں ,yes,
 جو ڈنڈا تیری امی کو قطری نے دیا تھا اسکے بارے میں کیا خیال ہے مادرچود کتی نسل کے ,yes,
 چپ مادرچود بالکل چپ,yes,
ارے مادرچود مرضی سے کون جاتا ہے جیل,yes,
تم مادرچود ہو  ,yes,
 مادرچود فرانس والی فیسلٹیاں بھی دو کراچی میں ۔۔ بیغیرت آدمی ۔۔ ,yes,
 یہ سارے مادرچود گرفتار ہونے کے بعد ہی بیمار کیوں ہوتے ہیں۔  ,yes,
 ابي چل مادرچود ,yes,
 یہ بیٹی بیچ ہے مادرچود  ,yes,
کیسی نوکری ہے اس مادرچود کی عید کے دن بھی چھٹی نہیں ہے  ,yes,
کس نے بولا تھا چوری کرو مادرچود بھڑوے گن…  ,yes,
یہ بھوسری کے ساراے مل کر ہم کو چھوٹیا بنا رہے ہیں مادرچود کے بجے  ,yes,
 اس کا مطلب ہے تیری ماں کیسی کتیا کے بچے لعنتی بے غیرت چوتیا مادرچود دھلے  ,yes,
کنجر,yes,
 کسی گشتی کے پتر ہیں یہ حرامی کافر مادرچود  ,yes,
یہ مادرچود دَلہ اپنے ناجائز باپوں کو اپ ڈیٹ دے رہا ہے  ,yes,
 اس کو کس مادرچود حرامی نے پاکستان بلوایا اس کی گ میں ڈنڈا ڈال کر اس بھی میکاسنگھ کے ساتھ انڈیا بھیج دو  ,yes,
 سی ایم ھریانہ تیری بیوی اور بیٹیوں کو کشمیر کی پہاڑیوں میں لے جاکر ریپ کریں گے تیری ماں کی چوت حرامی مادرچود  ,yes,
 اور تیری ماں اور بونڈی ھی رھے گا مادرچود ,yes,
 بھونک مادرچود بھونک ,yes,
یہ ہے ان بیغیرت لوگوں کا کنجر پنا نا یہ خود کام کرینگے نا ہی کسی کو کام کرنے دینگے  ,yes,
شیدے ٹلی مادرچود جا مر کشمیر تے مادرچود  ,yes,
 بھٹو کنجر شرابی بینظیر دلی کرپٹ عورت زرداری اپنی ماں کا یار کھسرا بلاول ایک سے ایک بڑھ کر کرپٹ مادر,yes,
 سب مادرچود ہیں کسی کو کشمیر کی فکر نہیں  ,yes,
 اب کیا کرنے لگے ہیں مادرچود  ,yes,
 مادرچود دو دودن ٹرینڈ میں ذلیل ہونے کے بعد آج اپنے باپ نواز شریف کی آپشن شامل ہی نہیں کی سب مادرچ,yes,
 مادرچود ہم کشمیریوں کا نام مت لے   ,yes,
 مراد سعید تو حرامی ہے اور تیرا کتا باپ عمرو نیازی مادرچود ہے تم دونوں گانڈو واشل ہو انڈیا نے تم سب,yes,
 واقعی سب کے سب مادرچود ایک صفحے پر ہیں  ,yes,
 ابے مادرچود ۔ سکھ مودی کا فرق سمجھ  ,yes,
" مادرچود، اپنی ماں کے جنازے پر آیا نہیں اور بکواس کر رہا ہے  ",yes,
 یار واقعی ماننا پڑیگا تم ایک حرامی النسل جانور کی پیداوار هو سمجه گئی مادرچود  ,yes,
یہ مادرچود بڑا فیمینسٹ نہیں بڑا مادرچود ہے  ,yes,
کوس,yes,
 اُس کا تو پتا نہیں لیکن تو فیصد میری غلطی کا نتیجے ہے تیری امی کو کہا بھی کہ گشتوڑ ,yes,
دو مادرچود لاہور کے جنہوں نے رابعہ خان نامی لڑکی کی عزت لوٹی ,yes,
مادرچود  ,yes,
 مادرچود دے بچے   ,yes,
" مجھے یہ مادرچود شروع سے ہی برا لگتا تھا ، زندگی کا پہلا ووٹ دیا اس اس بار سلیکشن میں ",yes,
یہ کس مادرچود کے دل کی بھڑاس نکالی گئی؟  ,yes,
 ابے بھڑوے کی نسل  ,yes,
 مادرچود بکواس بند کر  ,yes,
 تو بیغیرت ہے مادرچود دلے کنجر کے بچے تم سب چور ہو گشتی کے بچو گندی نالی کے کیڑوں حرام خوروں  ,yes,
 مادرچود انگریزی تو ڈھنگ سے لکھنا سیکھ لے ,yes,
 یہ سچ میں بہت مادرچود ,yes,
 سلیکٹیڈ نالائق اعظم عمران کتورا دلّا ہے حرامدہ ہے بیغیرت ہے کُتے کا بچہ ہے مادرچود ہے  ,yes,
کنواری رنڈی,yes,
 تم سے ؟ مادرچود رنڈی  ,yes,
 کوئی وجہ ہے کہ اس مادرچود کا خاندان کتے کی موت مارا گیا۔  ,yes,
 اوئے مادرچود ہیجڑو تم سے تو ہیجڑے اچھے ہیں جو کبھی عورت ہہ ہاتھ نہیں اٹھاتے انشاءاللہ تمہارا وقت بہت,yes,
 بلاول کو کہنے والے کتے تم تو کتے کی طرح بکواس کرتا ہے امریکی صدر کی جوتے پالش کرنے والے کتے ہو مادرچود تمہاری ماں کی چوت میں لن  ,yes,
 لگتا ہے یہ مادرچود سرپرائز بھول گئے اس کو دوبارہ یاد دلانا پڑے گا  ,yes,
وہ صرف کتے کے بچے تھے۔  ,yes,
یہ مادرچود خنزیر کے تخم سے ہیں  ,yes,
"کسی کتی کی بچے، مادرچود بہت ہی گھٹیا ہو تم، حرام کی پیداوار ہو تم، تمہار…  ",yes,
 چل مادرچود  ,yes,
 مادرچود کیا الگ گیراج میں لے جا کے گرفتار کرتے۔ کھوتی کے بچو اب پرانی عادتیں بھول جاؤ  ,yes,
 مادرچود نیب کی گاڑی کے آگے لیٹا کیوں نہیں تو  ,yes,
 یہ سب بے غیرت لوگ ہیں ان کو صرف اپنی سیاست بچانی ہے بس چور سب مادرچود ان کو کوئی فکر نہیں ہے مسلمانوں,yes,
اب وہ تمام مادرچود لبرلز ۔صحاف,yes,
 مادرچود صحافیوں کے نام پہ دھبہ ہے تو  ,yes,
 گٹر نیوز کے دفتر کو آگ لگائی جاے مادرچود کو  ,yes,
 جو دھندے تم سندھی بھڑوے کرتے ھو وہی بیان کر رھے ھو گانڈو  ,yes,
 مادرچود نونی ,yes,
 تیری ماں کی چوت بجنے پر سالا مادرچود اگر ماں کا دودھ پیا ہے تو ایک بار پاکستان آ میرا بیٹا تیری ماں کو نہ چودا تو کہنا سالے غدار  ,yes,
 مادرچود ایسے بول رہا ہے جیسے نیچے بہت تکلیف ہے تھوووو کتے تجھ پر امریکہ سے سودا منہگا کر کے آۓ ہو  ,yes,
" اس مادرچود کی سنو، تم جا کر ٹی وی شو کرو  ",yes,
اُلو کے پٹھے یہ تیرے کرنے کے کام نہیں ہیں  ,yes,
 اب سمجھ آئی گٹر کو گٹر ھی ریٹویٹ کیوں کرتا ہے مادرچود  ,yes,
گشتی کے بچے یہ بتاؤ,yes,
" یہ لے اپنی امی جان کی کُس میں تن دے کسی گشتی کے بچے۔ مادرچود، حرام کے پلے",yes,
 سینٹ کے الیکشن میں بھی ایسے ہی تو ب کر رہا تھا مادرچود  ,yes,
 تیری ماں تیری بہن کے یار ہیں انڈیا والے ,yes,
یہ وہ مادرچود ہیں جن کی پارلمنٹ کی بلڈنگ بھی پاکستان نے بھیک میں بنا کے دی تھی  ,yes,
 جسکو ٹیگ کررہا ہے نا تو یہ اسی مادرچود حرام النسل گانڈو کی بیٹی ہے جس نے کشمیری مجاہدین,yes,
 تو بہت ہی کسی گشتی کا بچہ ہے مادرچود  ,yes,
لٹکاؤ اس مادرچود کو ,yes,
 او مادرچود ,yes,
 تم مادرچود ہو ,yes,
 کسی ایک مادرچود نے ڈھنگ کا جواب نہیں دیا انڈیا کو ,yes,
یہ گانڈو خود کو سندھی بولتا ھے مگر فخر بلوچ ھونے پر کرتا ھے اور خود کا بلوچست,yes,
 بہن چودو کس نے بولا تھا ملک لوٹو اب دھاڑے مارو مادرچود دو  ,yes,
 ابھی گنجن کی اولاد تیرا بھی وقت آجائے گا بڑے بہت خوب بکواسیات کر رہا ہے مادرچود  ,yes,
 کنجری کے بچے اپنی ماں سے پوچھ کے اس کے اکاؤنٹ میں ڈالر کہاں سے بھڑوے مادرچود  ,yes,
 حرام خور کا پیٹ دیکھو ایک دفع شراب پی کے بھی پکڑا گیا تھا اس کو تو سرے عام کوڑے اس وقت تک…  ,yes,
 بٹھی کتے خنظیر مادرچود یہ وقت نہیں ہے کے تو ابھی بھی ان پر وار کصے اپنے باپ پر کر یا اس کے حواریوں,yes,
ڈارمے کررہا ہے مادرچود  ,yes,
 مادرچود تیری بھی فیملی ہے؟  ,yes,
مٹھ نال غرارے کرن آلی گشتن دیا بچیا اوئے مادرچود ذات دیا کنجرا ,yes,
 تیری ماں دی پھودی مادرچود  ,yes,
 نکل لوڑے پھیلی فرصت میں نکل بھوسڑیکے مادرچود ,yes,
" اوئے گانڈو کے جھریوں والے لوڑے، تو پہلے لکھنا سیکھ لے مادرچود، جُگت بعد میں",yes,
 گشتین صاحب کشمیر کی بات کر لو مادرچود  ,yes,
 تیری ماں دا ٹھوکو خان کُتی ماں دا بچہ ویچ آیا ای کشمیر مادرچودو غدارو تم لوگوں گی گانڈ میں ایسا ڈنڈا,yes,
 کون تیری ماں کا ٹھوکو تھا جس نے کشمیری خریت قیادت سے ملنے سے انکار کیا ؟؟  ,yes,
 مادرچود دلے اس اپنے باپ کو بھی سن کیا کہتا ہے  ,yes,
" چپ مادرچود بلکل چپ، جن کتوں کا نام تو لے رہا ہے نا، انکا مالک بھی وہی ہے جو تیرا ہے۔ تجھ جیسے کُتے دلے کے منہ نہیں لگتے ہم",yes,
 جس انسان کی زندگی دلالی اور PC ہوٹل میں دگڑ دلّا بن کے گُزری ہو اُس مادر چود کو ہاشوانی کنجر کہیں,yes,
 نکل بھوسڑی کے مادرچود گانڈو  ,yes,
ابھی تو تم مادرچود فائدہ اٹھانے کی کوشش کر رہی ہو۔ ملک دشمن  ,yes,
 پنڈی کی ٹاپ کی رنڈی سے شادی کی ہے مادرچود کشمیر کا اور سینٹ کے معاملے کا آپس میں کیا تعلق,yes,
 لگتا ہے سفینا نے اس عمر میں شیخ رشید کے لوڑے کے چوپے لگائے اور کھڑا نا کر پانے کی خفت میں سزا ملی,yes,
" یہ دیکھ رنڈی کی نسل ، یہ مادرچود غدار وطن ہے  ",yes,
" چوتیے تو تم ہو کسی کنجر کی نسل ، مادرچود بیچا تو تمہارے چور گنجے نے کشمیر کو  ",yes,
 تیرا باپ مادرچود بیچ کے آیا ہے حرام کے پِلّے ,yes,
 مادر چود رنڈی ,yes,
اس مادرچود نے تو اپنی ماں کو بھی چیلنج کر دیا تھا کہ ثابت کرو تمہارا خاوند ہہی مرا باپ ہے  ,yes,
 اسی معمولی سیلیکٹیڈ نے نواز مادرچود کو لنڈ کے چوپے کروائے ہیں اور تمہاری لیڈرنی کو بھی ,yes,
" گشتی کے بچے، دروازے کی چابیاں تیرے باپ باجوہ کے پاس ہیں۔ مادرچود اس کا نام لے جس نے تیری ماں چودی ہے۔ بھڑوا  ",yes,
 او کسی چمکیلے بڑکیلے لنڈ کو چوسنے کی خواہش کرنے والی گشتوڑی نوازشریف بڑوے کے بیان سن ,yes,
 جا نہ مادر چود  ,yes,
"تیرے جیسے جس مادرچود نے سودا کیا وہ کوٹ لکھپت میں سڑ رہا ہے آج کل ،تو اپنا پچھواڑا بچا جو کسی دن پھٹنے والا ہے حرام",yes,
 وہی جو قطری کے پاس مریم بھیجتا تھا مودی کی ماں کو ساڑھیاں بھیجتا تھا نوازشریف مادرچود ,yes,
پاکستان کی صحافت کا مہا حرامی ٹٹے چُک مادرچود ,yes,
 جاو مادرچود یہ ملک کا بیڑا غرق کردیا تم لوگوں نے  ,yes,
 چپ گشتی کے بچے ہم بھولے نہیں جب نواز UN میں برہان وانی کا کیس لڑو رہا تھا تو تیرے جیسے مادرچود ذات کے,yes,
"مادرچود، دلے کی بچی زنا کی پیداوار یہ دیکھ تیرے حرامی باپ نے کیسے پاکستان اور کشمیر سے غداری کی تھی۔ حرام کی اولاد ",yes,
 تیری ماں کو چودا ہے لیگیوں نے گشتی علیمہ رانڈ کا بھائی کتے کا بچہ عمران نیازی مادرچود نے کشمیر بیچ دیا ,yes,
 تو گدھے کا بچہ ہے مادرچود  ,yes,
 لکھ دی لعنت تہاڈے منہ چہ کھوتے خور پٹواریوں دی نانی اماں مودی کے یار غدار باپ ,yes,
" گشتی ماں کے بچے، کسی سورنی کا کتا ہے تو مادرچود  ",yes,
 اگر تب تو نے اشمت سے اپنی چوت نہ پڑوائ ہوتی تو آج تیرے گھر کُتے کا بچہ نا ہوتا مادرچود رنڈی  ,yes,
ایسے مادرچود یوتھئے ہیں کہ کشمیر ہاتھہ سے نکل رہا ہے لیکن یوتھئے ابھی بھی کشمیر کی ثالثی پر نیازی کی واہ واہ کررہے…  ,yes,
" مادرچود Freedom of expression جو اپنی وال پر لکھ لگایا ہے، وہ اب کشمیر میں تجھے نظر نہیں آتا؟؟؟ سور…  ",yes,
 کھسرے ملک خانہ جنگی کی حالت میں ہے کشمیر میں روزانہ کتنے لوگ شہید ہو رہے ہیں ,yes,
دنیا گول نہیں مادرچود ہے  ,yes,
 میڈم ریپ زدہ لاشیں ن لیگ کی دفتر سے نکلتے ہے اور زنا کار پی ٹی آئی والوں کو کیو ؟ مادرچود  ,yes,
جس مادرچود کو پیدا کرنے کے بعد ماں چاٹنا تک پسند نہیں کرتی وہ حرام کا تخم یہاں پاکستان اور اس کے اداروں کے خلاف بھو…  ,yes,
 ایک یہ مادرچود کا بچہ کھلا چھوڑا ہوا ہے کتے کی طرح بھونکتا رہتا ہے۔  ,yes,
 تب یہ مادرچود ایم کیو ایم میں تھا اور اپنا سیاسی چکلہ پی ایس پی نہیں کھولا تھا  ,yes,
 دونوں ہی مادرچود ہیں  ,yes,
یدی کے اپنی کالی بوتھی تو ڈی پی پے دکھا نہیں سکتا اور بھوکے پاکستانی ہیں مادرچود ہم کچھ نا کھا کے بھی تم سے ذیادہ…  ,yes,
 تو مادرچود بھڑوا ہے انڈیا کا تجھے کیا کشمیریوں سے اور کسی اور سے تجھے بس پاکستان آ رمی کے خلاف بھو…  ,yes,
 نام ہے نورانی لیکن ہے مادرچود لعنتی  ,yes,
دیکھ لو ڈیر رنڈین اکیلا شیر کھڑا ہے  ,yes,
تمہاری ہیجڑا فورس ایک نہتے کے سامنے بکری بنی ہے ڈوب مرو  ,yes,
دوستو یہ رنڈی اس قابل نہیں کہ اسکے بکواس سنو,yes,
"انڈین میڈیا جنرل قمر جاوید باجوہ کی ایکسٹینشن پر رنڈی رونا ڈال رہا ہے پاکستان میں پٹواری ، جیالے ، اور لفافہ خور صحافی",yes,
باڈر پہ سینے پہ گولی یہ گمنام ھیرو کھاتے ہیں ۔۔۔اور میڈلز مہوش حیات جیسے رنڈیو کو ملتے ہیں ۔۔۔افسوس ,yes,
تیرا بھی کوئی باپ انکل چاچا تایا ہے کہ بن مانس کی اولاد ہو گشتی نا ہو  ,yes,
یہ ہے گشتی کی اولاد ہیرا منڈی کی پیداوار فک یو  ,yes,
گشتی ماں کی گندی اولاد  ,yes,
بھونک مت تو دلی کی اولآد ,yes,
ھمیں بغیرت کہنے والے تم پر تو  دلالی اور بھڑوہ گری کا انٹرنیشنل ٹیگ لگا ہوا کہ  ماں بھی بیچ دیتے ہو  ,yes,
کسی گشتی کے بچے حرام زادے باپ کی اولاد حرامی اولاد جب تم لوگ اپنے باپ کت نہیں تو مادر چود بھڑوے حرامی پاکستان کے  ,yes,
گشتی کی بچی کو بتاٶ اب کیوں بند کیا ہے رنڈی کی اولاد  ,yes,
ایک ڈاکو دفعہ وزیر اعظم بنا اور لوگ کچھ چوتھی دفعہ کے لیے بھی رنڈی رونا کر رہے تو شرمندگی نہیں ,yes,
 معافی مانگو یا نہ مانگو تم جیسی رنڈیوں کو تو وہ سبق سکھا کر چھوڑے گا,yes,
 بلکل ٹھیک کہا تو نے رنڈی ہمارے سابق وزیراعظم اب تک مودی کی ٹانگیں توڑ چکے ہوتے ,yes,
 دلّے کُتے حرامی تیری بھین نوں L ,yes,
 بکواس بند کر حرامی کتے ,yes,
 اوئے لونڈے کتے اپنی بکواس بند کرو حرامی ,yes,
 بھائی حرامی ہی بکواس کرتے ہیں پاک فوج کے خلاف حلالی نہیں ,yes,
 شرم آنی چاہیے ان حرامیوں کو یہ بکواس کرنے سے پہلے جھوٹے سالے ,yes,
 اور جس طرح سے تم بیغیرتوں نے عوام کو بے دردی سے لُوٹا ہے اس سے تم لوگوں کا حرامی پن نظر آتا ہے ,yes,
 یہ بیغیرتوں کے ٹولے کا ادنا سا پیادہ ہے یہ وہی کچھ بک رہا ہے جو اسکو ڈکٹیٹ کیا گیا ہے  ,yes,
بہت ہی کوئی حرامی نسل ہیں یہ پٹواری کوئی موقع ہاتھ سے جانے نہیں دیتے  ,yes,
عظمی بخاری اپنی بیغیرتی دیکھتے ہوئے  ,yes,
 تم بھی صحافی بننے کا خواب دیکھتے دیکھتے حرامی بن گۓ ہو  ,yes,
 اس کی ماں کو رنڈی باپ کو حرامی اسکو ہیجڑا بے شرم بے حیاء بے غیرت نہ کہیں تو اور کیا کہیں؟  ,yes,
 کمینے اور حد سے گٹھیا انسان تو چاہتا کیا ہے کہ پاکستان جنگ کر دے اور بیغرت انسان مودی حرامی کو سبق سیکھا دے ,yes,
لگتا ہے حرامی ہندووں تم اپنے باپ ٹیپو سلطان کو بھول چکے ہو جس کے آنے سے تمہاری ماوں کے بچے گر جایا کرتے تھے ,yes,
 کیونکہ اب فواد حرامی جیسے کنجر ہمارے حکمران ہیں جو کشمیر کو بیچ آئے ہیں۔ ہمیں تم جیسے بے غیرت نہیں چا ہیے ,yes,
"پاکستان میں بسنے والے چوتیا ، عقل سے محروم لوگوں کے ہاتھ ٹوئیٹر لگ گیا اور یہ حرامی ہر اس ٹرینڈ پر بھی ٹوئیٹ کرتے ہیں ",yes,
 اللہ کرے یہ اچهے صحافی جلد مر جاہیں تاکہ جلد جنت میں جاہیں اس سے پہلے کہ یہ حرامی ھو جایں  ,yes,
 تیری ماں چودوں تیرا اماں کا یار ھندؤں کی آنکھوں میں آنکھیں ڈالنے والے  ,yes,
" یہ ساری گالیاں نواز شریف کو لگ رہی ہیں کیونکہ سودا اُسی حرامی نے کیا ہے، زرداری کے ساتھ ملُکے  ",yes,
لعنتی مردود مبشر ذیدی کا کام ہی اسلام اور اسلامی احکام شریعت پرتنقیدکرنا ہے ,yes,
 او دلے کسی گشتی کی حرامی نسل تیرا بھونکنا بند نہیں ہوگا لیکن کسی دن اس کی طرح عوام کے ہتھے آیا تو مر جاۓ گا ,yes,
 اللہ کرے یہ اچهے صحافی جلد مر جاہیں تاکہ جلد جنت میں جاہیں اس سے پہلے کہ یہ حرامی ھو جایں  ,yes,
 ایسے نہیں ایسے سن زراہ غور سے حرامی  ,yes,
 لعنت اس کتے کے شکل پر  ,yes,
" اس کتے کے پلے کو کیوں گورنمنٹ نے اتنی ڈھیل دے رکھی ہے جب ،جس پہ جی چاہے بھونکتا رہتا ہے حرامزاده  ",yes,
 اس کتے کے بچے کھسری کو گولی مار دینی چاہئے  ,yes,
کُتے پخائے ہوئے ہیں پاکستانی ٹوئیپس نے  ,yes,
 کسے کتی دیا پترا تیری سزا یہی ہے تیری نسل تیرے ساتھ ہی ختم ہوجائے گی وہ دس دن سے کرفیو میں ہیں  اور تو جشن منا رہا ہے  ,yes,
 لعنت ہو مودی کتے پی  ,yes,
 گالی دینے والوں حرامیوں وقت تمیں معاف نھیں کرینگے انشاءاللہ کتے کی موت مرو گے سب کے سب حؤس کے پجاریوں ,yes,
 مودی کتے مار جا تیری ماں نو ,yes,
" غلطی ہماری ہے،نہ تم جیسوں کوگلے لگاتے نہ آج یہ منہ دیکھنا پڑتا،یہ انڈین مہاجر اتنے حرامی ہیں ",yes,
 اپنی بہن کے ساتھ زیادتی کے قصے نہ سنا گانڈو جو تیرے ساتھ ہوئی وہ تو آباد زدہ عام ہے کتے ,yes,
 بےشرم کنجر لوگوں جواب تو ہمیں بھی نہیں دیا کسی کھسری کے بچے تو ہمارا جواب دے ,yes,
 کتنے حرامی ہیں نا تمھارے سالے بوڑھے بیمار باپ کو ایک بار جیل ملنے نہیں آۓ ۔ خود اشتہاری ہیں بوڑھا باپ ,yes,
تجھے ان دونوں حرامیوں کی بہت فکر ھے؟  ,yes,
 لعنت تیری صحافت پر کھوتی کے بچے ثابت کیا کرنا چاہتے ہو خبیث انسان  ,yes,
 ڈنگر دے بچے تو انسان ہے ہی نہی خبیث ,yes,
تجھ سے بڑا خبیث اور گانڈو نہیں دیکھا دلے انسان جھوٹے فریبی لعنتی انسان ,yes,
 خبیث انسان اس موقع پر تو اپنی سیاست چمکانے میں لگا ہوا ہے حرامی کی نسل کچھ شرم نہیں تم لوگوں میں  ,yes,
عجیب گندی عورت ہو تم بے شرم عورت اس میں عمران خان کا قصور کہاں۔ سے ہو,yes,
کنجر جب بغیر ویزے تیرے لیڈر کا یار مودی آیا تھا نواز بٹ کے گھر۔  ,yes,
 یہ سب کنجر لوگ ہے اور کنجروں کے گھر کنجر ہی پیدا ہوتے ہیں مجاہد نہیں  ,yes,
 اب تیری گانڈ مارنے کا ٹائم آنے والا ہے تھوڑا انتظار کرو کنجروں کی ترجمانی کرنے والی گشتی تیری اوقات,yes,
کنجری اپنے پیدا کرنے والےمہا کنجروں کے ساتھ  ,yes,
 سودا تو تم لوگ کرتے ہو بے غیرتوں کنجروں دَلیوں حرامیوں تمہاری شکل پر لعنت پڑی ہوئئ…  ,yes,
اگر اپنی اور خاندان کی  بے عزتی کا خیال ہوتا تو کنجروں  ,yes,
 یہ بیغیرت ہیں اور ہمیشہ رہے گے لیکن انکو چُننے والے بھی برے بیغیرت ہیں,yes,
 لعنت تم کنجروں اور حرامیوں پر جو تم جیسے گٹری کیڑوں کی وجہ سے پاکستان پر مشکلات آرہی ہیں  ,yes,
کنجروں نو رات نو نیند نا آوے  ,yes,
 کتوں اور کنجروں کی حکومت اور گشتیاں رنڈیاں وزیر  ,yes,
 اوہ کنجر بیٹی فروش,yes,
 پھر ان کنجروں کی بات کر,yes,
مریم کی عیاشی کا نمونہ جنید صفدر حرامی سات ارب کا,yes,
لعنت ہے سندھ سرکار پر,yes,
"لعنت اس بیغیرت کے منہ پے، کنجروں کے پاس اختیارات ہونے کے با وجود یہ حال ہے، اس بیغیرت کو عوام کو حوصلہ دینا چاہیے",yes,
لعنت ہے تم لوگوں کی خاموش بندوقوں اور توپوں پر۔  ,yes,
لعنتی نشی کتا بیغرت سلیکٹڈ زانی کنجھر خبیث ذلیل منافق جھوٹا قادیانی دلا حرامی پالتو ثور   ,yes,
گشتی بہن کے دلے  ,yes,
 تیری گانڈ میں بنا تھوک کے کب,yes,
 کسی گشتی کے بچے کسے کتے کی آوارہ اولاد مادر چود کے بچے تیری گانڈ میں کیڑ,yes,
گشتی خانے بھیجنا چاہیے  ,yes,
 ہان صرف تیر نہین کو چھوڑ کر گشتی کے بچے  ,yes,
 وقاص علوی کسی گشتی کی حرامی نسل سے ہے کتے کے پلے تیری ماں کو پتہ نہیں ہوگا تیرا باپ کون تھا  ,yes,
 اے تے شکلوں ای کوٸی گشتی لگدی اے۔  ,yes,
