Tweets,Positive,Negative
ان لوگوں کو پاسپورٹ چاہیے ہوتے ہیں تو لڑکیوں سے شادی کرلیتے ہیں اور پاسپورٹ ملنے کے بعد انکی غیرت جاگ جاتی ہے بلاول,,no
جس نے بھی ان چوروں کو عزت دیں اللہ پاک کی ذات انکو عبرت کا نشان بنائے کیونکہ ان درندوں نے میرے ملک کو لوٹا ہے  ,,no
آج اگر کشمیر مصیبت میں هے تو گنجے کی وجه سے  ,,no
اصل بات یے هے که نون لیگ غازی ممتاز کو شهید کرایا اور غستاخوں ملک سے…  ,,no
اصل مسئله نون لیگ کا یے هے که انهوں نے اسلام دشمنی کی اور غازی ممتاز کو شهید کیا تو اس دن سے نون لیگ کی تنزلی شروع…  ,,no
یا اللہ۔ اسے روڈ پر جاتے ہوئے ٹرک کے نیچے دے دے تاکہ اس کا سر ٹائر کے نچے آ کر دھماکے سے ہھٹ جائے اور اس کا دماغ ٹر…  ,,no
ایک مسلمان ہونے کے ناطے سے میری افواج پاکستان سے اپیل ہوگی کہ اگر مودی بے غیرت حکومت پاکستان پر جنگ مسلط کرتی ہے تو…  ,,no
پاکستان کا وجود اللہ کا پلان ہے اور جو کوئی بھی اس سے بے وفائی کرے گا وہ براہ راست اللہ سے بے وفائی کرے گا اور تباہ…  ,,no
"ظالم ہمیشہ صفحہ ہستی سے عبرت کا نشان بن کر مٹے ہیں، اور تاریخ ان پر تھو تھو کررہی ہے۔ انڈیا اور مودی کا اس ضمن بلند… ",,no
آج ھمارے گریٹ لیڈر قائد اعظم محمد علی جناح کا دو قومی نظریہ پوری دنیا کو سمجھ آگیا ھے بہت جلد عمران خان کا نظریہ بھ… ,,no
یہ تو اچھا انسان ہیں اچھا ایڈمنسٹڑ کیسے ,,no
بن سکتا ہے سیاست کوئ اناڑی نہیں کر سکتا ,,no
ایک منجے ہوے سیاست کو عبرت کا نشان… ,,no
کوئی ظلم کرنے میں فرعون بن جائے ,,no
بے شک اللہ کا انصاف ہونے پہ غرق ہو جاتا ہے ,,no
پھر وہ کچھ بنے نہ بنے نشان عبرت ضرور بنت… ,,no
اللہ تعالی اس ناسور کو جہنم واصل کرے یا اللہ اس ﻇا لم کو دنیا میٮ لوگوٮ کے لیے عبرت کا نشان بنا دے ,,no
ایک بات کی تو مودی کو داد دینی چاہیے کہ کسی صحافی کی جرات نہیں اسکے کاموں کے خلاف آواز اٹھانے کی۔ پاکستان کی سول سو… ,,no
بے شک الله کا انصاف ہونے پہ غرق ہوجاتا ہے ,,no
پھر وہ کچھ بنے نشان عبرت ضرور بنتا ہے۔۔ … ,,no
لعنتی انشاءاللہ تمہیں پاکستان تو کیا روۓ زمیں کی مٹی بھی نصیب نہیں ہو گی ,,no
تمہاری موت پوری دنیا کے لۓ عبرت کا نشان ب… ,,no
پاکستانی عوام مودی کو خطے میں بدامنی اور فساد کا موجب یقین کرتی ہے اور اسکی بدمعاش تھانیداری کو نشان عبرت بنانے کا… ,,no
بہت جلد دنیا کو ایک عبرت ناک منظر دیکھنے کو ملے گا۔ ,,no
اور وہ بھارت کی شکل میں ہوگا۔ جب بھارت کو عبرت کا نشان بنا دیا… ,,no
بھارت کے لیے جلد ہی یہ دن سیاہ ترین باب بننے والا ہے سیاہ کرتوتوں سے بھارت کو ایسی سیاہی نصیب ہونے والی ہے کہ جس کی… ,,no
اے اللہ کشمیری عوام کی مدد فرما ,,no
اور ان پر ظلم کرنے والوں کو عبرت کا نشان بنا دے ,,no
غرورِ امیراں میں جینے والو۔ ڈرو اس وقت سے جب آپ کو اللہ کی لاٹھی آ پکڑے گی اور آپ عبرت کا نشان بنا دیئے جاؤ گے ,,no
کچھ لوگوں کے دلوں سے خوف خدامٹ گیا ہے اوراب وہ اپنے آپ کو توبہ استغفار فرعون کی طرح خدا سمجھ بیٹھے ہیں۔ڈرو اس وقت س… ,,no
اےربِ کعبه ہمارےملک کو اَمن کا گہوارہ بنادے ,,no
کتنے جسٹس مانگیں گئے اور ہر دفعہ ٹرینڈ ٹاپ پر آیا مگر ہو کیا کچھ بھی نہیں یہاں انصاف ہوتا تو آج یہ… ,,no
سوات کالام کے نوجوان مسکین شہید کے قاتلوں کی گرفتاری پر ہم پنجاب حکومت کے شکرگزار ہیں ,,no
لیکن صرف گرفتاری کافی نہیں ب… ,,no
سندھ کے عوام کو لوٹنے والے عبرت کا نشان بننے کے قریب۔ جعلی اکاؤنٹس کیس کے مرکزی کردار دبئی کے شہر ناصر عبداللہ لوتھ… ,,no
ہٹلر نے ظلم کیا عبرت کا نشان بن گیا ظلم کی ابتدا ء خوف اور انتہا عبرتناک ہوتی ہے ,,no
یہ ہیں وہ زرائیع جن کا حق چھین کر پوری دنیا میں پراپرٹی بنائی گئی ہے یا اللہ ان غریبوں کا مال کھانے والوں کو عبرت ک… ,,no
ہم اپنی افواج کے قدم سے قدم ملا کر دشمن کو عبرت کا نشان بنائیں گے افواج پاکستان کے لیے دعائیں کریں اسلام کا قلعہ پا… ,,no
افواج پاکستان جزبہ ایمان جزبہ شہادت اور قوم کی دعاوں کے ساہے میں ہیں کسی کو پریشان ہونے کی ضرورت نہیں ہماری افواج ہ… ,,no
ہم اپنی افواج کے قدم سے قدم ملا کر دشمن کو عبرت کا نشان بناہیں گے افواج پاکستان کے لیے دعاہیں کریں اسلام کا قلعہ پا… ,,no
جس جس نے اس ملک کو لوٹا ہے اور جس جس نے اس ملک کی جڑیں کھوکھلی کیں ہیں اللہ تعالیٰ ان سب کو ,,no
زلیل و رسوا کرے تو سبق یہ سیکھا ,,no
چوری کرو تو اربوں کی نہیں تو عبرت کا نشان بنا دئیے جاو گے ,,no
پنجاب ہوتا تو کو کہہ دیتے مگر… ,,no
چار دن کی چاندنی پھر اندھیری رات ہے۔۔ اس مثال کے مطابق تمام چور آج نشان عبرت بنے جیلوں میں پڑے ہیں۔ ,,no
گود سے گور تلک جتنے بھی سمعے بیتے ہیں ,,no
ہم مسلمان شہادت کے لیے جیتے ہیں ,,no
صرف مودی کو بنانا ہے عبرت کا نشان ,,no
انڈین آرمی کو انشاءاللہ تعالی اللہ پاک عزت پوری دنیا میں عبرت کا نشان بنا… ,,no
"مانا کہ کشمیری عوام کمزور ھے، لیکن عنقریب ظالم عبرت کا نشان بنیں گے ",,no
خان صاحب ان چوروں کو اب لٹکا دیں ,,no
ملت کا خسارہ ہیں یہ اور انکو نشان عبرت بنا دیں اب ,,no
پاکستانی انتظار میں ہیں کہ ک… ,,no
انتہا پسندی صرف یہ نہیں کہ بندوق اٹھاکر کسی پر اپنے نظریات مسلط کرنے کی کوشش کی جائے بلکہ کسی کے مذہبی عقائد کا مز… ,,no
"مودی ہر چیز کا حساب دے گا انشاءاللہ، بھارت کے ساتھ ملے ہر ملک کو اللہ تعالیٰ عبرت کا نشان بنا دے آمین ثم آمین ",,no
آٶ دعا کرتے ہیں اللہ پاک اس کے غرور اور اس کو جلد سے جلد خاک میں ملا دے۔۔اور اس شخص کو عبرت کا نشان بنادے۔آمین ,,no
دعا ہے اللہ تعالیٰ کشمیری مسلمانوں کو بہت جلد آزادی کا سورج دکھائے ا… ,,no
یہ ہی باجوہ عمران نیازی کو عبرت کا نشان بننآ ے گا ,,no
"قبرستان ایسے صحافیوں کے ساتھ بھی بھری پڑی ہیں جنہوں نے ساری زندگی صرف منافقت، جھوٹ اور نفرت پھیلانے کا کام کیا اور… ",,no
مودی کے ابو فرعون ,,no
کاہنات کا سب سے ظالم عبرت کا نشان بن گیا تو انشااللہ مودی بھی عبرت کی مثال بنے گا ,,no
یہ نوازشریف اور آصف زرداری کی حکومتی پالیسی کی وجہ سے آج ہم اس مقام پر کھڑے ہیں کہ انڈیا جیسا ملک ہم کو دھمکی دیت… ,,no
کیا اس نوجوان کا جرم اتنا بڑا تھا کہ اسے مار مار کر موت کے گھاٹ ہی اتار دیا جاتا؟ ,,no
"ہم کس حق سے خود کو پہلے گواہ، پ… ",,no
تجھ جیسے غداروں کو بے نقاب کردیا جائے گا بہت جلد اور تمہارے آقاؤں انڈیا ازرائیل اور امریکہ کو عبرت کا نشان بنادیا ج… ,,no
 گرین پاسپورٹ عبرت کا نشان بن گیا میکسیکو اور برازیل کی سیر کے لئے جانے والی پاکستانی خاتون ,,no
سوات میں سکول بند ہونے پر ملالہ نے پوری دنیا میں پاکستان کے خلاف بکواس کی تھی ایک ہفتے سے کشمیر میں سکول بند ہیں اب کہاں مر گئی ہے۔ ,,no
چلیں جی شروع کرتے ہیں یہ ٹرینڈ اور پٹواریوں اور پیپلیوں کی بکواس کا جواب دیتے ہیں ,,no
ایک سال میں عمران خان نے پاکس… ,,no
"وہ پاکستانی یوٹیوبرز جنکے بکواس سارا سال ہمیں سننا پڑتا ہے،لیکن جب پاکستان پہ کوئی کڑا وقت آتا ہے تو انکو انڈیا کے… ",,no
شیخ رشید کے دوست اتنے چوتئے ہیں کہ انڈوں کی برسات کرنے والوں کو تو روک نہ سکے لیکن عقابی نگاہوں نے ویڈیو بنانے وا… ,,no
یہ وہی حضرت نہیں جو پہلے لڑکیوں کا نام لے کر بکواس کرتے ہیں پھر رو رو کے پوچھتے ہیں۔۔ ,,no
 سر جی میں نے آپ کو بولا کی… ,,no
پاکستان پہلے ایک غریب ملک ہے ۔۔ اوپر سے یہ انڈیا کی وجہ سے دفاع پہ پاکستان کو بے تحاشہ پیسے خرچ کرنا پڑ رہے ہیں جو… ,,no
لن دی بکواس ھے ,,no
اصل خبر کچھ یوں ہے؛ ,,no
سیلیکٹڈ وزیراعظم عمران نیازی آج یوتھیا قوم سے خطاب نہیں کریں گے۔ اس اعلان پر پاکستانی قوم نے شک… ,,no
وہ اک کتی ڈاڈو چارجر بہت بکواس کر رہی تھی ایسی عورت کا رشتہ نہیں آتا لامبا آتا ہے خالی اپنی عورت نما لڑکی نو سمجھا… ,,no
شرم کرو پٹواریوں بدنیت لوگوں کبھی تو اس ملک کے لیۓ بھی ایک قوم بننے کی کوشش کرو تمھارے یہ سیاسی چور لیڈران جن کی تم… ,,no
اس آدمی کی سیٹی میں اتنا سُر ہے جتنا سلمان احمد جیسے دو لاکھ میراثیوں کے ساری زندگی کے بکواس گانوں میں نہ ہو ,,no
بیرون ملک رہنے والے غیر ملکیوں کے دلے پاکستان میں ٹیکس نظام کے نفاذ پر بکواس کرتے ہیں اور وہاں فیصد ٹیکس دے کر ک… ,,no
ایک سال ہوگیا Pti کی حکومت کو ۔ ان سے کار کردگی کا پوچھو تو ان کا جواب بکواس کی صورت میں ہوتا ہے۔ ,,no
پی ٹی آئی کی ایک سال کی کارکردگی بکواس کے علاوہ اور کچھ نہیں ,,no
اور ان لوگوں کے مریم کے میڈیا ونگ کے بارے میں کیا کیا فرضی بکواس نہیں کی ,,no
جو کھوتاخور یہ بکواس کررہے ہیں کہ سلامتی کونسل کا اجلاس چین نے بلوایاہے تو ان کیلئےعرض ہے کہ سال ہوگئے نے او تہاڈ… ,,no
کس قدز بکواس کرتا ہے یه بنده ارسطو صاب آپ نے ہی عوام کو ٹرک کی بتی پیچهے لگایا ہوا تها یہ سب کہہ کر دراصل تم اپنے م… ,,no
بکواس سن لو اس اردو بولنے والے کی۔ ,,no
اگر تیری بات مان لی جائے تو وہ ٹی ٹی کے باوجود عوام کو سہولت دے رہے تھے مفت عل… ,,no
لبرل قادیانی قادیانی نوازو ان کے ابو گریٹ ویلڈر سور ٹرمپ بابا خادم حسین رضوی کے خلاف کیوں بکواس کرتے ان سے ڈرتے ہیں… ,,no
کرنے دو جو بکواس کرتے ہیں ۔۔۔۔۔ ,,no
خالی برتن ہمیشہ آواز کرتے ہیں ۔۔۔۔ ,,no
اور۔ آپ نے تو بہت کچھ کیا عوام کے لیے سالوں ایک اچھا ہسپتال تک تو تم لوگ سال میں بنا نہ سکے اور بکواس کرتے ہو ایک… ,,no
پپو خالی بکواس ہی کرتا ہے ,,no
 تبدیلی کی برسی نہیں چوروں کی برسی جو ملک کو بھی کھا گۓ لوٹ کر اور اس کی فوج کے خلاف بکواس کرتے ہیں سستے لونڈے تے لونڈیاں ,,no
کیا بکواس ہے۔ ,,no
کسی اچھے اردو بولنے والے کو ہی ڈھونڈ لیا ہوتا۔ ,,no
خیر اگلی بار جب ایسی بکواس کرنے کا سوچو تو اپنے اداکار… ,,no
ایک باسٹرڈ نیشنل ٹی وی پر بیٹھ کر وزیراعظم پاکستان عمران خان کے بارے میں عمران عمران کر کے تنقید کر رہا ہے۔ کوئی ہے… ,,no
تمہارا لہجا بتا رہا تمہارے خاندان کی پہچان جہاد اور جو گالی آج تم نے دی ایسی گالی کو لے کر تم لوگ بابا جی پر تنقید… ,,no
کپتان نے یوٹرن لیتے ہوئے آج قوم سے بکواس کرنے کا پروگرام کینسل کر دیا کچھ بتانے کو ہے ہی نہیں تقریر تیار کرنے والے… ,,no
آج جو عمران خان پر بکواس کررہھ ہیں جب ایک دو سال کے بعد زبردست کامیابی ملے گی تو پٹواری اور درباری کہیں گے کہ یہ تو… ,,no
افغان قوم کو چاہیے کہ وہ اپنے ایسے دشمنوں کو پہچانے جو بجائے اصل قصوروار کی مذمت کرے یہ پاکستان کے خلاف بکواس کر رہ… ,,no
عمران نے سر عام جھوٹ بولے پر وہ نیک کیوں کیوں کے میڈیا یہودو نصارا کے ہاتھ ہمارے لوگوں کو خرم خوری کی عادت ڈال دی گ… ,,no
یوٹرن لیتے ہوئے آج قوم سے بکواس کرنے کا پروگرام کینسل کر دیا ,,no
کچھ بتانے کو ہے ہی نہیں تقریر تیار کرنے والے بھی پریشان ,,no
انڈین عوام اور انڈین آرمی زیادہ بکواس نہ کرو یہ اوقات ہے تمہاری ,,no
بکواس نا کریں ,,no
احساس کرنا چاہیے نہ کہ بکواس ۔ ,,no
بات ىه هے که جب هم بھارتى چائے والوں کا منه توڑ رهے هوتے هىں تو پىچھے سے پٹوارى اپنى بکواس شروع کر دیتے هىں اور کپت… ,,no
آج وہ لوگ بھی جنگ کی بات کر رہے ہیں جنہوں نے زندگی میں غلیل تک کو چھوا نہیں ہوگا گھر بیٹھ کر ٹویٹ کرنے والوں جو تم… ,,no
شکر ہے کچھ لوگوں کو مغیرہ کی داڑھی پر بکواس سے داڑھی کی عظمت کا تو احساس ہوا ورنہ وہ خود طارق جمیل کے خلاف جب تک ٹو… ,,no
کیا بکواس ھے۔۔۔۔۔۔ ,,no
"ٹوٹل بکواس، ",,no
"تمام منصوبے پہلے آنے والی حکومتوں نے ہی متعارف کروائے، ماسوائے سیٹیزن پورٹل کے انہوں نے بس تختیاں ہی چ… ",,no
سب ڈرامےبازی ھےکشمیرکامکمل سوداکردیاگیاھے کچھ دن کےبعد سب بھول جاۓگےکشمیرمیں کیاھورہاھےدن سےوہاں پرکرفیوھےاقوم مت… ,,no
گل مک گئی اے ۔ ہون بکواس کرنا ضروری سی یا عادتوں مجوراو ,,no
جب کوئ پاک فوج پر بکواس کرتا یے تو ان شہیدوں کے لواحقین پر کیا گزرتی ہوگی ۔۔۔۔۔ عقل اور دل کے اندھوں کو شاید اس تصو… ,,no
"شاہیں،غوری،ابدالی،اللہ کے کرم کے بعد دفعائی بجٹ کا کمال ہے،اللہ کا شکر ادا کریں،ا… ",,no
کچھ لوگ تحریک لبّیک پاکستان کے پیچھے گالی بد دعا کر رہے ہیں ۔۔۔۔۔۔ کیوں کے لبّیک والے حق ب… ,,no
اسلام علیکم دوستوآپ لوگ دشمن کیخلاف جہادکررہےہوکلمہ حق لکھ کردشمن کومنہ توڑجواب دےکراسکی صفوں میں ہلچل مچادی آپ لوگ… ,,no
حکمران اب بھی یہى بکواس کر رہے ہیں کہ اگر هم جنگ ہار گئے تو ؟ ,,no
لیکن یہ مسلمان کاموقف نہیں ,,no
ایک سال ہوگیا Pti کی حکومت کو ۔ ان سے کار کردگی کا پوچھو تو ان کا جواب بکواس کی صورت میں ہوتا ہے۔ اوریا مقبول ,,no
 شہبازکےخلاف بکواس نامنظور ,,no
اس گھٹیا ترین زہنیت کی بس مزمت ہی کی جا سکتی ہے ,,no
پنجاب سے لوگوں کو منتخب کرنے والے میرے… ,,no
بکواس بند کر اپنی اور گندے پانی منہ دھو جا کے ,,no
یہ کیا بکواس بکتے ہو ,,no
جس ملک سے لاکھوں کماتے اسی کے قانون کے ساتھ کھیلتے۔ ان کی تمام برانچز بند کرکے عبرت کا نشان بنانا چاہیے ,,no
"يا اللہ جو بھی حکمران رہے، ان معصوم بچوں کا حساب ان سے ليں، چاھے وہ وزير اعظم تھا يا کونسلر ان سبکو اسی جہان ميں ع… ",,no
"بھائی ان کی سب دوکانوں کو سیل کرو ۔ ان کی بدماشی نکالو، یہ لوگ ایک روپے کا بھی ٹیکس نہیں دیتے اور روزانہ لاکھوں روپ… ",,no
"جب اپنے جرائم کا ارتکاب کر لیا، اور جرائم بھی وہ، جو آج تک پاکستان کی تاریخ میں جس نے بھی کیے اسے نشان عبرت بنادیا… ",,no
کوئی بتائے گا کہ ہمارے قمر درد والے شیر نے بکنے والے سینیٹرز کو نشان عبرت بنانے کا جو اعلان کیا تھا اسکا کیا بنا ,,no
ڈاکٹر فوزیہ نےاللہﷻ کا کتاب جلایا اللہﷻ انکو دنیا میں سب لوگوں کے سامنے نشان عبرت بنائیں فوزیہ تم انسان نہیں درندے… ,,no
فرق جان کر جیو ,,no
ایک طرف دھرتی کے بہادر سپوت نوجوان نے جان کا نذرانہ دے کر اپنے جہاز کو وطن دشمنوں کے پاس نہیں جانے… ,,no
اس لڑکی کو جو بھی کہئے کم ہے ,,no
بس ہم اللہ سے یہ دعا کرتے ہے کہ یا اللہ اس کو نشان عبرت بنا دے اور اس کو ایسی سزا د… ,,no
فوزیہ نامی لعنتی عورت پر لعنت بھیجنے کے سوا میرے پاس الفاظ نہیں ہے ,,no
دوستو یہ رنڈی اس قابل نہیں کہ اسکے بکواس سنو,,no
میں مج آرمی چیف کی مدت ملازمت میں توسیع کا خیر مقدم۔کرتا ھوں ۔ اور اس غیرت شخص پر بھیجتا ھوں جو… ,,no
سر اس حرام زادے غدار کی بکواس پڑھ لے اس کا تو کوئی بندوبست کرے ,,no
جو لوگ بکواس کرتے تھے کہ ابا بچاو مہم شروع ہوئ ہے انکو مبارک ہو آج ابا کو انکے لیڈر نے بچا لیا کیسے نہ بچاتا خود بھ… ,,no
اوکے۔۔۔ اب کوئی مجھے سمجھائے کہ اس حکومتی بکواس کو کہاں دفنانا ہے ؟ ,,no
"گزشتہ سال سے آئے روز حکومت، ریاست، فوج و عدلیہ کیخلاف بکواس؟ آج پاکستان کے تمام بحرانوں کی زمدار چوراپوزیشن… ",,no
صرف ٹویٹر پہ بکواس کرنا ہی آسان ہے ,,no
"اسی فوج کی وجہ سے تم جیسے غدار بکواس کرنے کے قابل ہیں، ورنہ انڈیا کب کے تمھارے پرخچے اڑا چکا ہوتا ",,no
کاشف عباسی اپنے پروگرام میں کہتا ھے کہ جو پیچھے سے حکومت چلاتے ھیں۔۔ان کو سوچنا چاھیے۔۔ ,,no
اس اینکر کو چینل والے پوچھی… ,,no
جی نواز شرہف نے جناب کو ایجنسی سے اٹھواکر ٹھکائ لگوائ تھی لہذا نواز شریف کا احسان یاد ھے۔ سیٹھی صاحب۔کیا آپ نے عمرا… ,,no
یہ ہے پٹواریوں کی زبان جو آرمی چیف کی ملازمت میں توسیع پر بکواس کریں گے ۔۔ ,,no
زبان اندر رکھیں گے تو انہیں تکلیف ہو گی… ,,no
عمران نیازی سال مسلسل بکواس کرتا رہا کہ بیرون ملک پاکستانیوں کے ارب ڈالر پڑے ہیں اور حکومت میں آتے ہیں یہ پیس… ,,no
جدیدتحقیق سے ثابت ہوا ہے کہ جس دن آپ بکواس ترین حلیے میں ہوں اُسی دن محلے کی کسی خوبصورت حسینہ سے آپ کا آمنا سامنا… ,,no
پٹواری ایسی گندی نسل ہے ,,no
اگر آرمی چیف باجوا صاحب ریٹائرڈ ہوتا تو انہوں نے بکواس کرنی تھی ,,no
لیں جی ایک تو بھارت سے ڈر ک… ,,no
سسیلین مافیا پہ جج ارشد ملک کی مبینہ وڈیو کا سارا معاملہ الٹ پڑ گیا ۔ شہبازشریف نے مریم پہ اور مریم نے سارا معاملہ… ,,no
ہم دشمن پر سبقت رکھتے ہؤے بھی خاموش ہیں شائد اسی لئے ان ڈرپوکوں کو بکواس کرنے کی ہمت ہوئی ہے ,,no
پاکستان سے ہزاروں میل دور بیٹھی ثنا تتلی کی آنکھوں اور اس کے تاثرات آپ کو ملک سے محبت کا درس بھی ملے گا اور حوصلہ… ,,no
"کہاں ہیں پٹواری، کھوتا کھا کھا کہ ان کے دماغ بند ہو گئے ہوئے ہیں، لعنتی عورت صرف ٹویٹر پر بکواس ہی کر سکتی ہے، بڑی… ",,no
انکی بکواس بھی روکی جاے ,,no
ارشاد بھٹی وہ سیانا کوا ہے جو ہر ٹاک شو میں نون لیگ کے خلاف بکواس بھی کرتا ہے اور پھر ریٹ بڑھانے کے لئے سلیکٹڈ حکوم… ,,no
ہم نے سنا تھا پاک فوج پروفیشنل فورس ہے۔ ,,no
"مگر یہ جھوٹ تھا، یہ سب بکواس تھا ",,no
چوتیے اپنے مالکوں کی جیل سے چیخیں سن کر بھی تجھے عقل نہیں آئی ,,no
ٹٹے پوشی اتنی کر جتنی برداشت کرسکے ,,no
جتنا آپ کو بکواس کر کے ہوتا ,,no
مہینہ ہوا لاتعداد کمپلینٹ کے باوجود گھر کے قریب ٹاور میں زونگ فور جی ٹھیک نہیں ہوا۔ ,,no
فیصلہ کر لیا ہے کہ پانچوں میں س… ,,no
"ہم نہ کسی کے مذہب کو چھیڑتے ہے ناں اپنے مذہب پر بات سنتے ہیں ، لیکن اگر کوئی بلاوجہ ہمارے مذہب کے خلاف بکواس کرے تو… ",,no
کاش اج وہ زندہ ہوتا ,,no
دیکھیں حامد ماضی میں ایکسٹنشنز کے بارے میں جو کچھ میں نے کہا وہ نری بکواس تھی۔۔۔ ,,no
اوے حنزیر متہ کی اولاد۔۔بکواس نہ کر ,,no
انڈین کتوں کا بکواس کرنا سمجھ میں آتا ہے لیکن یہ پٹواری کیوں بھونک رہے ہیں؟؟؟؟ پٹواریوں اور لفافہ صح… ,,no
جس طرح پٹواری بکواس کر رہے ہیں اس طرح تو انڈین کتے بھی نہیں کر رہے بہت گھٹیاں سوچ ہے پٹواریوں کی۔… ,,no
خان صاحب خدا کے لئے عوام پر رحم آج کل ذرداری اینڈ نواز شریف مولانا ڈیزل ایسی مہم چلی ھے مہنگائی کے نام پر کہ عوام… ,,no
اوُئے گدھے کے منہ والے میجر اپنا یہ گٹھیا بکواس بند کر ۔ ,,no
اب یہ سارے احسان کی گردان بھونکیں گے ,,no
اس وقت بس سمجھ لو بکواس ہی تھی اب سہی فیصلہ کیا ہے۔ ,,no
میں بھی پنجابی سنی جٹ ہوں اگر اب کسی نے چیف صاحب کے بارے میں بکواس کی تو میں نے احتجاجاً شیخ کو آگ لگا دینی ہے ,,no
